{
  "meta_version": "10.0.3",
  "date": "2026-07-25",
  "lineage_id": "La0b845ea2c",
  "cluster_id": 186,
  "cluster_name": "France and Spain wildfires force 200,000 evacuations near Bordeaux and Madrid",
  "salience_score": 19.565,
  "n_outlets": 24,
  "n_countries": 15,
  "n_articles": 33,
  "tldr": "Headlines across 24 outlets in 15 countries lead almost universally with mass-displacement statistics — evacuation figures ranging from 80,000 to 220,000 — making quantified human scale the dominant advertised signal across all geographic and editorial perspectives. The headline layer contains no climate attribution whatsoever; the only departure from the evacuation-count template is Le Parisien, whose two French-language titles avoid statistics entirely and address firefighter exhaustion and wildfire-induced mental health trauma — a framing completely invisible in every non-French outlet's headlines.",
  "event_summary": "Wildfires swept southwestern France and central Spain on July 24-25, 2026, forcing more than 200,000 people to flee near Bordeaux and Madrid; Spain declared a national emergency and France activated the EU Civil Protection Mechanism.",
  "frames": [
    {
      "frame_id": "QUALITY_OF_LIFE",
      "sub_frame": "Mass displacement; tourists and residents flee",
      "outlets": [
        "AFP / France 24 FR",
        "Al Jazeera English",
        "BBC World",
        "Bol News",
        "CBC World",
        "Daily Mirror",
        "Deutsche Welle English",
        "Globe and Mail",
        "Japan Times",
        "Malay Mail World",
        "RT",
        "Sydney Morning Herald",
        "Tehran Times",
        "The Guardian World",
        "The Independent"
      ],
      "countries": [
        "france",
        "qatar",
        "uk",
        "pakistan",
        "canada",
        "germany",
        "japan",
        "vietnam_thai_my",
        "russia",
        "australia_nz",
        "iran_state"
      ],
      "evidence": [
        {
          "outlet": "Daily Mirror",
          "country": "uk",
          "quote": "Brits among 200,000 fleeing scorched tourist areas",
          "signal_text_idx": 12
        },
        {
          "outlet": "Deutsche Welle English",
          "country": "germany",
          "quote": "Thousands flee by boat as fires spread, merge",
          "signal_text_idx": 16
        },
        {
          "outlet": "Al Jazeera English",
          "country": "qatar",
          "quote": "force evacuation of 200,000 people",
          "signal_text_idx": 7
        },
        {
          "outlet": "The Guardian World",
          "country": "uk",
          "quote": "flee or lock down as wildfires sweep France and Spain",
          "signal_text_idx": 28
        }
      ]
    },
    {
      "frame_id": "CAPACITY_RESOURCES",
      "sub_frame": "Fires beyond containment; firefighters overwhelmed",
      "outlets": [
        "AFP / France 24 EN",
        "ARY News English",
        "Japan Times",
        "Le Parisien",
        "Straits Times",
        "Times of India"
      ],
      "countries": [
        "wire_services",
        "pakistan",
        "japan",
        "france",
        "vietnam_thai_my",
        "india"
      ],
      "evidence": [
        {
          "outlet": "AFP / France 24 EN",
          "country": "wire_services",
          "quote": "Firefighters face fatigue after days of relentless",
          "signal_text_idx": 0
        },
        {
          "outlet": "Japan Times",
          "country": "japan",
          "quote": "wildfires spin out of control in France and Spain",
          "signal_text_idx": 19
        },
        {
          "outlet": "Le Parisien",
          "country": "france",
          "quote": "Des pompiers « épuisés » et la crainte",
          "signal_text_idx": 21
        },
        {
          "outlet": "Times of India",
          "country": "india",
          "quote": "'Intense, highly unpredictable'",
          "signal_text_idx": 32
        }
      ]
    },
    {
      "frame_id": "POLITICAL",
      "sub_frame": "National emergency declarations; military mobilized",
      "outlets": [
        "AFP / France 24 EN",
        "AfricaNews",
        "Daily Sabah",
        "Malay Mail World",
        "The Hindu Intl",
        "The Independent"
      ],
      "countries": [
        "wire_services",
        "pan_african",
        "turkey",
        "vietnam_thai_my",
        "india",
        "uk"
      ],
      "evidence": [
        {
          "outlet": "AFP / France 24 EN",
          "country": "wire_services",
          "quote": "Spain declares emergency as fires spread",
          "signal_text_idx": 1
        },
        {
          "outlet": "Daily Sabah",
          "country": "turkey",
          "quote": "Spain declares emergency as wildfires threaten",
          "signal_text_idx": 14
        },
        {
          "outlet": "The Independent",
          "country": "uk",
          "quote": "France sends in army while winds in Spain",
          "signal_text_idx": 30
        },
        {
          "outlet": "The Hindu Intl",
          "country": "india",
          "quote": "Spain declares national emergency over wildfires",
          "signal_text_idx": 29
        }
      ]
    },
    {
      "frame_id": "HEALTH_SAFETY",
      "sub_frame": "Mental health toll; survivors sheltering indoors",
      "outlets": [
        "Le Parisien",
        "Straits Times",
        "Hindustan Times"
      ],
      "countries": [
        "france",
        "vietnam_thai_my",
        "india"
      ],
      "evidence": [
        {
          "outlet": "Le Parisien",
          "country": "france",
          "quote": "stress post-traumatique, angoisses",
          "signal_text_idx": 20
        },
        {
          "outlet": "Straits Times",
          "country": "vietnam_thai_my",
          "quote": "'You couldn't breathe'",
          "signal_text_idx": 25
        },
        {
          "outlet": "Hindustan Times",
          "country": "india",
          "quote": "flee or hole up indoors",
          "signal_text_idx": 18
        }
      ]
    }
  ],
  "outlet_isolation_top": [],
  "outlet_exclusive_vocab_highlights": [],
  "paradox": null,
  "silences": [],
  "single_outlet_findings": [
    {
      "outlet": "Le Parisien",
      "country": "france",
      "finding": "Both Le Parisien headlines are the only titles in the corpus to avoid evacuation statistics entirely — one addresses firefighter exhaustion and fear of further deaths, the other addresses mental health trauma — a humanitarian framing completely invisible in all non-French headlines.",
      "signal_text_idx": 20
    },
    {
      "outlet": "Straits Times",
      "country": "vietnam_thai_my",
      "finding": "Only outlet to open with a survivor testimony ('You couldn't breathe') rather than an evacuation number, centering embodied experience over quantitative scale in a way unique among Southeast Asian establishment press.",
      "signal_text_idx": 25
    },
    {
      "outlet": "Daily Mirror",
      "country": "uk",
      "finding": "Only outlet to single out British nationals as a specific affected demographic — 'Brits among 200,000 fleeing scorched tourist areas' — anchoring the pan-European crisis to UK audience identity rather than a neutral count.",
      "signal_text_idx": 12
    },
    {
      "outlet": "Daily Sabah",
      "country": "turkey",
      "finding": "Only outlet to foreground EU collective action ('EU deploys aircraft') in the headline itself rather than centering human displacement, emphasising institutional response over humanitarian scale.",
      "signal_text_idx": 13
    },
    {
      "outlet": "Tehran Times",
      "country": "iran_state",
      "finding": "Reports only '80,000 flee' — roughly one-third of the 220,000 figure cited by BBC World — the lowest evacuation figure across all outlets, suggesting early snapshot timing rather than deliberate minimisation.",
      "signal_text_idx": 27
    }
  ],
  "coverage_caveats": [],
  "bottom_line": "The headline layer of this wildfire story is a near-uniform row of evacuation statistics: 24 outlets in 15 countries used their titles to broadcast a displacement number, with no outlet naming climate change as a driver anywhere in a headline despite three outlets carrying that framing in body text. The sole variation came from French domestic press, where Le Parisien's two headlines broke the template entirely to address firefighter exhaustion and wildfire-induced mental health damage.",
  "generated_at": "2026-07-25T10:30:00Z",
  "model": "claude-sonnet-4-6"
}
